file_name,uni,wylie,url,dept,grade,char_len,audio_len,path,inf
STT_TT00826_0270_1934223_to_1943250,ཡིན་ན་ཡང་། དེའི་རྗེས་སུ་སྒྲ་ལ་མི་རྟག་པ་སྒྲུབ་པའི་ཟེ་དུས། སྒྲ་ཡི་སྟེང་དུ་མི་རྟག་པ་སྒྲུབ་པའི་ཨེ་ནས་ངག་བཀོད་དགོས་ཀི་རེད། སྒྲུབ་ངག་བཀོད་དགོས་ཀི་རེད་ཟེ། སྒྲ་ལ་མི་རྟག་པ་སྒྲུབ་པའི་ངག་རབ་ཏུ་འཇུག་དགོས་པ་ཡིན་ཏེ།  ,yin na yang /_de'i rjes su sgra la mi rtag pa sgrub pa'i ze dus/_sgra yi steng du mi rtag pa sgrub pa'i e nas ngag bkod dgos ki red/_sgrub ngag bkod dgos ki red ze/_sgra la mi rtag pa sgrub pa'i ngag rab tu 'jug dgos pa yin te/__,https://d38pmlk0v88drf.cloudfront.net/wav16k/STT_TT00826_0270_1934223_to_1943250.wav,STT_TT,2,203,9.027,wav16k/STT_TT00826_0270_1934223_to_1943250.wav,ཡིན་ན་ཡང་། དེའི་རྗེས་སུ་སྒྲ་ལ་མི་རྟག་པ་སྒྲུབ་པས་ཟེར་དུས། སྒྲ་ཡི་སྟེང་དུ་མི་རྟག་པ་སྒྲུབ་པའི་ཨེ་ནས་ངག་བཀོད་དགོས་ཀི་རེད། སྒྲུབ་ངག་བཀོད་དགོས་ཀི་རེད་ཟེ། སྒྲ་ལ་མི་རྟག་པ་སྒྲུབ་པའི་ངག་རབ་ཏུ་འཇུག་དགོས་པ་ཡིན་ཏེ།
STT_TT00827_0004_19906_to_23458,གཞན་སེལ་བའི་ཡུལ་ཅན་མིན་པ་ལ་གནོད་པ་བསྟན་པ་ཟེ་ཡ་གི་ད་ས་བཅད་དེ་ལ་བྱས་ན།  ,gzhan sel ba'i yul can min pa la gnod pa bstan pa ze ya gi da sa bcad de la byas na/__,https://d38pmlk0v88drf.cloudfront.net/wav16k/STT_TT00827_0004_19906_to_23458.wav,STT_TT,2,70,3.552,wav16k/STT_TT00827_0004_19906_to_23458.wav,གཞན་སེལ་བའི་ཡུལ་ཅན་མིན་པ་ལ་གནོད་པ་བསྟན་པ་ཟེ་ཡ་གི་ད་ས་བཅད་དེ་ལ་བྱས་ན།
STT_MV0420_0033_273584_to_279559,ཁྱོད་རང་ག་བར་གཟིགས་ཀི་ཡོད། ཞུས་ཙང་བྱས་། ཨུ་གོ། ངས་ཁྱོད་རང་ལ་ཞུ་ཡ་གཅིག་ཡོད། ང་ཚོ་འདིའི་དཀྱིལ་ནས་ཁྱོད་རང་མཇལ་འདོད་གནང་མྱི་ཞིག་འདུག ,khyod rang ga bar gzigs ki yod/_zhus tsang byas /_u go/_ngas khyod rang la zhu ya gcig yod/_nga tsho 'di'i dkyil nas khyod rang mjal 'dod gnang myi zhig 'dug_,https://d38pmlk0v88drf.cloudfront.net/wav16k/STT_MV0420_0033_273584_to_279559.wav,STT_MV,2,129,5.975,wav16k/STT_MV0420_0033_273584_to_279559.wav,ཁྱེད་རང་ག་བར་ཟེར་གི་ཡོད། ངས་ཁྱེད་རང་ཞུ་ཡ་གཅིག་ཡོད། ང་ཚོ་འདིའི་དཀྱིལ་ནས་ཁྱེད་རང་རྗེས་ཟདོད་གནང་མྱི་ཞིག་འདུག
STT_TT00827_0010_51237_to_60691,ཨེ་ནས་ད་ལྟ་འདི་ལ། ཨེ་ནས་སྒྲ་ངེས་པའི་ངེས་ཤེས་སུ་མ་ཟད་གསུངས་དུས། སྔར། དོན་གྱི་རང་གི་ངོ་བོ་ཅིག། བདག་ཉིད་མངོན་སུམ་ཡིན་པ་ལ། ཚད་མ་རྣམས་ཀྱིས་བརྟག་བྱ་གང་། མ་མཐོང་ཆ་གཞན་ཅི་ཞིག་ཡོད། གསུང་ཡོང་དུས།  ,e nas da lta 'di la/_e nas sgra nges pa'i nges shes su ma zad gsungs dus/_sngar/_don gyi rang gi ngo bo cig/_bdag nyid mngon sum yin pa la/_tshad ma rnams kyis brtag bya gang /_ma mthong cha gzhan ci zhig yod/_gsung yong dus/__,https://d38pmlk0v88drf.cloudfront.net/wav16k/STT_TT00827_0010_51237_to_60691.wav,STT_TT,2,187,9.454,wav16k/STT_TT00827_0010_51237_to_60691.wav,ཨེ་ནས་ད་ལྟ་འདི་ལ། ཨེ་ནས་སྒྲ་ངེས་པའི་ངེས་ཤེས་སུ་མ་ཟད་གསུངས་དུས། སྔར་དོན་གྱི་རང་གི་ངོ་བོ་གཅིག བདག་ཉིད་མངོན་སུམ་ཡིན་པ་ལ། ཚད་མ་རྣམས་ཀྱིས་བརྟགས་བྱ་གང། མ་མཐོང་ཆ་ཞན་ཅི་ཞིག་ཡོད། གསུང་ཡོང་དུས།
STT_TT00827_0008_37261_to_40520,ད་འདིའི་ཨ། སྒྲ་ངེས་པའི་ངེས་ཤེས་སུ་མ་ཟད་ཟེ།  ,da 'di'i a/_sgra nges pa'i nges shes su ma zad ze/__,https://d38pmlk0v88drf.cloudfront.net/wav16k/STT_TT00827_0008_37261_to_40520.wav,STT_TT,2,44,3.259,wav16k/STT_TT00827_0008_37261_to_40520.wav,ད་འདི་ཨ་ སྒྲ་ངེས་པའི་ངེས་ཤེས་སུ་མ་ཟད་ཟེ།
STT_TT00827_0016_98643_to_100912,ཨ་ནས། ངེས་ཤེས་དེ་སྒྲུབ་འཇུག་ཡིན་པ་མཚུངས་ན།  ,a nas/_nges shes de sgrub 'jug yin pa mtshungs na/__,https://d38pmlk0v88drf.cloudfront.net/wav16k/STT_TT00827_0016_98643_to_100912.wav,STT_TT,2,44,2.269,wav16k/STT_TT00827_0016_98643_to_100912.wav,ཨེ་ནས། ངེས་ཤེས་དེ་སྒྲུབ་འཇུག་ཡིན་པ་མཚུངས་ན།
STT_TT00827_0017_104663_to_107159,བྱས་ཙང་། དེའི་ཁ་ཐུག་དེ་ལ་ང་རང་ཚོས་བསམ་བློ་གཏང་དགོས་ཡ་གཅིག་ལ།  ,byas tsang /_de'i kha thug de la nga rang tshos bsam blo gtang dgos ya gcig la/__,https://d38pmlk0v88drf.cloudfront.net/wav16k/STT_TT00827_0017_104663_to_107159.wav,STT_TT,2,62,2.496,wav16k/STT_TT00827_0017_104663_to_107159.wav,བྱས་ཙང་དེའི་ཁ་ཐུག་དེ་ལ་ང་རང་ཚོས་བསམ་བློ་གཏང་དགོས་ཡ་ཅིག་ལ།
STT_MV0420_0036_287024_to_291739,སྒྲོལ་མ་ལགས་ནང་ལྟར་མཛེས་མ་འདི་འདྲས་ཀིས་ཁྱོད་ནང་ཚོ་དཀྱིལ་ལ་ཕེབས་འདོད་གནང་གི་མ་རེད། ཧ་ཧ་ཧ། བྱས་ན་ཁྱོད་རང་གིས་ང་ངོ་སྤྲོད་གནང་དང་།  ,sgrol ma lags nang ltar mdzes ma 'di 'dras kis khyod nang tsho dkyil la phebs 'dod gnang gi ma red/_ha ha ha/_byas na khyod rang gis nga ngo sprod gnang dang /__,https://d38pmlk0v88drf.cloudfront.net/wav16k/STT_MV0420_0036_287024_to_291739.wav,STT_MV,2,128,4.715,wav16k/STT_MV0420_0036_287024_to_291739.wav,སྒྲོལ་མ་ལགས་གནང་ལྟར་མཛེས་མ་འདེ་འདྲས་ཀིས་ཁྱེད་རྣང་ཚོའི་དཀྱིལ་ལ་ཕེབས་འདོད་གནང་གི་མ་རེད། ་ུ་ང་བྱས་མོ་སྤྲོད་གནང་ད།
STT_MV0420_0040_308866_to_313855,ཁྱོད་རང་ཕྱི་རྒྱལ་ལ་ཕེབས་མྱི་སོང་ཙང་། ཞལ་གྱེས་གསོལ་ཚིགས་ག་དུས་བཤམ་གནང་ག་ལགས། ཞུས་ཙང་བྱས། ཁྱོད་རང་གསང་དུ་མ་ཐེད་ལ།  ,khyod rang phyi rgyal la phebs myi song tsang /_zhal gyes gsol tshigs ga dus bsham gnang ga lags/_zhus tsang byas/_khyod rang gsang du ma thed la/__,https://d38pmlk0v88drf.cloudfront.net/wav16k/STT_MV0420_0040_308866_to_313855.wav,STT_MV,2,113,4.989,wav16k/STT_MV0420_0040_308866_to_313855.wav,ཁྱེད་རང་ཕྱི་རྒྱལ་ལ་ཕེབས་མྱི་སོང་ཙང་ཞལ་གྱེས་སེལ་ཚུལ་ག་དུས་བཤམས་གནང་ག་ལག། བྱས་ཙང་བྱས། ཁྱེད་རང་གས་དེ་མ་ཐེད་ལ།
STT_MV0420_0042_317349_to_325298,ཧ་ཧ་ཧ། ང་ཚོའི་ཚེ་བརྟན་ལགས། གཤོག་པ་སྐྱེས་རྗེས་མགྱོགས་པོ་འཕུར་བྲོར་ཡོད་རེད་དཱ། བྱས་ཙང་བྱས། ལོ་ཁ་ཤས་ཕྱིན་ནས་ཚེ་བརྟན་ལགས་ཀིས་རྒྱ་གར་བའི་བུ་མོ་ཞིག་མནའ་མ་འཁྲིད་ཕེབས་བྲོར་ཡོད་ན།  ,ha ha ha/_nga tsho'i tshe brtan lags/_gshog pa skyes rjes mgyogs po 'phur bror yod red dA/_byas tsang byas/_lo kha shas phyin nas tshe brtan lags kis rgya gar ba'i bu mo zhig mna' ma 'khrid phebs bror yod na/__,https://d38pmlk0v88drf.cloudfront.net/wav16k/STT_MV0420_0042_317349_to_325298.wav,STT_MV,2,172,7.949,wav16k/STT_MV0420_0042_317349_to_325298.wav,ཧ་ཧ་ཧ། ང་ཚོའི་ཚེ་བརྟན་ལགས་ཤོགས་པ་སྐྱུར་བྱས་མགྱོགས་པོ་ཕེབས་གྲོར་ཡོད་རེད་ད། ཧབྱས་ཙང་བྱས། ལོ་ཁ་ཤས་ཕྱིན་ནས་ཚེ་བརྟན་ལགས་ཀིས་རྒྱ་གར་བའི་བུ་མོ་ཞིག་མནའ་མར་ཁྲིད་ཕེབས་བྲོར་ཡོད་ན།
STT_TT00827_0020_119671_to_121687,ཨེ་ནས་སྐྱོན་བརྗོད་པའི་ཟོལ་འདྲ་ཅིག་བྱེད་ཀི་འདུག་ཨ་ཟེ་ལབ་དུས།  ,e nas skyon brjod pa'i zol 'dra cig byed ki 'dug a ze lab dus/__,https://d38pmlk0v88drf.cloudfront.net/wav16k/STT_TT00827_0020_119671_to_121687.wav,STT_TT,2,61,2.016,wav16k/STT_TT00827_0020_119671_to_121687.wav,ཨེ་ནས། སྐྱོན་བརྗོད་པའི་ཟོལ་འདྲ་ཅིག་བྱེད་ཀི་འདུག་ཨ་ཟེ་ལབ་དུས།
STT_TT00827_0028_175842_to_178082,ཨེ་ནས། མངོན་སུམ་ཁོ་རང་ལ་སྐྱོན་བརྗོད་ཆོག་པ་དེ་ག་རེ་རེད་ཟེ་ན།  ,e nas/_mngon sum kho rang la skyon brjod chog pa de ga re red ze na/__,https://d38pmlk0v88drf.cloudfront.net/wav16k/STT_TT00827_0028_175842_to_178082.wav,STT_TT,2,61,2.24,wav16k/STT_TT00827_0028_175842_to_178082.wav,ཨེ་ནས། མངོན་སུམ་ཁོ་རང་ལ་སྐྱོན་བརྗོད་ཆོག་བ་དེ་ག་ེ་རེ་ཟེར་ན།
STT_TT00827_0031_196500_to_199380,སྤྱིར་བསྟན་པའི་ཁ་ཐུག་ལ་ངེས་ཤེས་དེ་ལ་སྒྲུབ་འཇུག་ཡིན་ན་སྐྱོན་བརྗོད་ཚར་དུས།  ,spyir bstan pa'i kha thug la nges shes de la sgrub 'jug yin na skyon brjod tshar dus/__,https://d38pmlk0v88drf.cloudfront.net/wav16k/STT_TT00827_0031_196500_to_199380.wav,STT_TT,2,74,2.88,wav16k/STT_TT00827_0031_196500_to_199380.wav,སྤྱིར་བསྟན་པའི་ཁ་ཐུག་ལ། ངེས་ཤེས་དེ་ལ་སྒྲུབ་འཇུག་ཡན་ན་སྐྱོན་བརྗོད་ཚར་དུས།
STT_TT00827_0032_201460_to_203732,སྒྲུབ་འཇུག་ཡིན་ན་འདི་འདྲའི་གི་སྐྱོན་ཅིག་ཡོད་རེད་ཟེ་ལབ་ཡོང་དུས།  ,sgrub 'jug yin na 'di 'dra'i gi skyon cig yod red ze lab yong dus/__,https://d38pmlk0v88drf.cloudfront.net/wav16k/STT_TT00827_0032_201460_to_203732.wav,STT_TT,2,64,2.272,wav16k/STT_TT00827_0032_201460_to_203732.wav,སྒྲུབ་འཇུག་ཡིན་ན་འདི་འདྲའི་གི་སྐྱོན་ཅིག་ཡོད་རེད་ཟེ་ལབ་ཡོང་དུས།
STT_TT00827_0033_204445_to_208592,དེ་ལ་ཡ་སྤྱིར་བསྟན་པ་ད་བྱེ་བྲག་ཏུ་བསྟན་པ་ཟེ་ཡ་གི་ཁྱད་པར་དེ། ཡོང་དོན་མེད་པའི་ཟོལ་འདྲ་བོ་ཅིག ,de la ya spyir bstan pa da bye brag tu bstan pa ze ya gi khyad par de/_yong don med pa'i zol 'dra bo cig_,https://d38pmlk0v88drf.cloudfront.net/wav16k/STT_TT00827_0033_204445_to_208592.wav,STT_TT,2,90,4.147,wav16k/STT_TT00827_0033_204445_to_208592.wav,དེ་ལ་ཡ་སྤྱིར་བསྟན་པ་ད་བྱེ་བྲག་ཏུ་བསྟན་པ་ཟེ་ཡ་གི་ཁྱད་པར་དེ་ཡོང་དོན་མེད་པའི་ཟོལ་འདྲ་བོ་ཅིག
STT_TT00827_0007_31390_to_36629,དེའི་ཕྱིར་དེ་ལྟར་རྟགས་སེལ་བའི། ཡུལ་ཅན་ཡིན་པར་རབ་ཏུ་བསྒྲགས། གཞན་དུ་ཆོས་ཅན་གྲུབ་གྱུར་ན། དེ་ལས་མ་གྲུབ་གཞན་ཅི་ཡོད། ཟེ་དེའི་བར་དུ་རེད་འདུག་ཨ།  ,de'i phyir de ltar rtags sel ba'i/_yul can yin par rab tu bsgrags/_gzhan du chos can grub gyur na/_de las ma grub gzhan ci yod/_ze de'i bar du red 'dug a/__,https://d38pmlk0v88drf.cloudfront.net/wav16k/STT_TT00827_0007_31390_to_36629.wav,STT_TT,2,138,5.239,wav16k/STT_TT00827_0007_31390_to_36629.wav,དེའི་ཕྱིར་དེ་ྟག་རྟགས་ཟེ་བས། ཡུལ་ཅན་ཡིན་པར་རབ་ཏུ་སྒྲགས། གཞན་དུ་ཆོས་ཅན་གྲུབ་རྱེས་ན། དེ་ལས་མ་གྲུབ་གཞན་ཅི་ཡོད་ཟེ། ེ དེའི་བར་དུ་རེད་འདུག་ཨ།
STT_TT00827_0009_41697_to_51015,ད་སྒྲ་མི་རྟག་རྟོགས་ཀི་རྗེས་སུ་དཔག་པ་ལས་ཀྱང་སེལ་བ་མི་གོ་བར། དངོས་པོ་ཁོ་ན་འཛིན་ན་གསུང་དུས། རྗེས་སུ་དཔག་པ་ལས་ཀྱང་ཟེ་ཡ་གི་ཀྱང་སྒྲ་དེ་གི་བསྡུ་བྱ་ལ།  ,da sgra mi rtag rtogs ki rjes su dpag pa las kyang sel ba mi go bar/_dngos po kho na 'dzin na gsung dus/_rjes su dpag pa las kyang ze ya gi kyang sgra de gi bsdu bya la/__,https://d38pmlk0v88drf.cloudfront.net/wav16k/STT_TT00827_0009_41697_to_51015.wav,STT_TT,2,144,9.318,wav16k/STT_TT00827_0009_41697_to_51015.wav,ད་སྒྲ་མི་རྟག་རྟོགས་ཀི་རྗེས་སུ་དཔག་པ་ལས་ཀྱང་སེལ་བ་མི་གོ་བ་དངོས་པོ་ཁོ་ན་འཛིན་ན་གསུངས་དུས། རྗེས་སུ་དཔག་པ་ལས་ཀྱང་ཟེ་ཡ་གི་ཀྱང་སྒྲ་དེ་གི་གདུལ་བྱ་ལ།
STT_MV0420_0058_418595_to_426176,ཁྱོད་རང་པཱ་ལགས་དམ་པ་དེའི་སློབ་སྦྱོང་གནང་ས་ཐེད་འདོད་ཡོད་མ་གསུང་པེ། ཁྱོད་རང་གི་དངུལ་ཏོག་ཙི་དེས་ང་གསོ་ཐུབ་གནང་པ་འདུག་གེ ,khyod rang pA lags dam pa de'i slob sbyong gnang sa thed 'dod yod ma gsung pe/_khyod rang gi dngul tog tsi des nga gso thub gnang pa 'dug ge_,https://d38pmlk0v88drf.cloudfront.net/wav16k/STT_MV0420_0058_418595_to_426176.wav,STT_MV,2,117,7.581,wav16k/STT_MV0420_0058_418595_to_426176.wav,ཁྱེད་རང་པཱ་ལགས་དམ་པ་འདི་སློབ་སྦྱོང་གནང་སར་ཐེན་འདོད་ཡོད་མ་གསུངས་པེ། ཁྱེད་རང་གི་དངུལ་བལྡས་ས་དི་ང་སོ་ཐུག་གནང་པ་འདུག་གེ
STT_MV0420_0060_434566_to_440296,ངའི་མནའ་མར་ཕེབས་དང་།  ,nga'i mna' mar phebs dang /__,https://d38pmlk0v88drf.cloudfront.net/wav16k/STT_MV0420_0060_434566_to_440296.wav,STT_MV,2,22,5.73,wav16k/STT_MV0420_0060_434566_to_440296.wav,ངའི་མནའ་མར་ཕེབས་དང།
STT_MV0420_0061_447147_to_457146,གཉེར་པ་ལགས། ཕྱག་ཕེབས། ཨོ།  ,gnyer pa lags/_phyag phebs/_o/__,https://d38pmlk0v88drf.cloudfront.net/wav16k/STT_MV0420_0061_447147_to_457146.wav,STT_MV,2,27,9.999,wav16k/STT_MV0420_0061_447147_to_457146.wav,གཉེར་པ་ལགས། ཕྱག་ཕེབས། ཨུམཨོ
STT_MV0420_0062_458601_to_467738,དབང་རྒྱལ། ལགས། ལྟོས་དང་། ལྕམ་སྐུ་ཤོགས་ཆིབས་རྟ་བཟུམ་ཞིག ལགས་སེ། མགྱོགས་སེ།  ,dbang rgyal/_lags/_ltos dang /_lcam sku shogs chibs rta bzum zhig_lags se/_mgyogs se/__,https://d38pmlk0v88drf.cloudfront.net/wav16k/STT_MV0420_0062_458601_to_467738.wav,STT_MV,2,75,9.137,wav16k/STT_MV0420_0062_458601_to_467738.wav,དབངས་རྒྱལ། ལག། ལྟོས་ད་ལྕམ་སྐུ་ཤོགས་ྤྱིར་ལྟ་ཅིག་ཟིམ་ཤིག ལགས་སོ། མགྱོགས་སེ། ་ཧ
STT_MV0420_0063_467738_to_470886,ལྕམ་སྐུ་ཤོགས། གཟབ་གཟབ་གནང་ཨ།  ,lcam sku shogs/_gzab gzab gnang a/__,https://d38pmlk0v88drf.cloudfront.net/wav16k/STT_MV0420_0063_467738_to_470886.wav,STT_MV,2,30,3.148,wav16k/STT_MV0420_0063_467738_to_470886.wav,ལྕམ་སྐུ་ཤོགས་གཟབ་གཟབ་གནང་ཨ།
STT_MV0420_0065_474496_to_482149,ཧི། རྟ་འདི་ཡང་ཡག་པོ་ཞིག་ཟིམ་ཐུབ་ཀི་མི་འདུག་གེ ག་རེ་རེད།  ,hi/_rta 'di yang yag po zhig zim thub ki mi 'dug ge_ga re red/__,https://d38pmlk0v88drf.cloudfront.net/wav16k/STT_MV0420_0065_474496_to_482149.wav,STT_MV,2,57,7.653,wav16k/STT_MV0420_0065_474496_to_482149.wav,རྟ་འདི་ཡག་པོ་བྱསག་ཟིམ་ཐུབ་ཀི་མི་འདུག་གེ ག་རེ་རེད།
STT_MV0420_0066_482149_to_485113,ཟ་འདྲེ་ཁྱུ་གཅིག་གསོས་ཤག ,za 'dre khyu gcig gsos shag_,https://d38pmlk0v88drf.cloudfront.net/wav16k/STT_MV0420_0066_482149_to_485113.wav,STT_MV,2,24,2.964,wav16k/STT_MV0420_0066_482149_to_485113.wav,ཟ་འདྲེ་ཁྱུ་གཅིག་གསོས་ཤག
STT_TT00827_0011_62960_to_72039,སྒྲ་འཛིན་མངོན་སུམ་གིས་དྲངས་པའི་སྒྲ་ངེས་པའི་ངེས་ཤེས་དེ། ཨེ་ནས་སེལ་འཇུག་ཡིན་པ་མ་ཟད། སེལ་འཇུག་ཡིན་པ་ག་རེ་ཟ་བསྒྲུབས་རེད་བ། སྒྲུབ་འཇུག་མ་ཡིན་པ་བསྟན་ནས་སེལ་འཇུག་ཡིན་པ་བསྒྲུབས་རེད་བ།  ,sgra 'dzin mngon sum gis drangs pa'i sgra nges pa'i nges shes de/_e nas sel 'jug yin pa ma zad/_sel 'jug yin pa ga re za bsgrubs red ba/_sgrub 'jug ma yin pa bstan nas sel 'jug yin pa bsgrubs red ba/__,https://d38pmlk0v88drf.cloudfront.net/wav16k/STT_TT00827_0011_62960_to_72039.wav,STT_TT,2,177,9.079,wav16k/STT_TT00827_0011_62960_to_72039.wav,སྒྲ་འཛིན་མངོན་སུམ་གིས་དྲངས་པའི་སྒྲ་ངེས་པའི་ངེས་ཤེས་ཀི་དེ། ཨེ་ནས་ སེལ་འཇུག་ཡིན་པ་མ། སེལ་འཇུག་ཡིན་པ་ག་རེ་ཟ།་སྒྲུབ་རེད་བ། སྒྲུབ་འཇུག་མ་ཡིན་པར་བསྟན་ནས་ སེལ་འཇུག་ཡིན་པ་བསྒྲུབ་རེད་བ།
STT_TT00827_0013_88033_to_91201,ཨེ་ནས་དེ་མ་ཡིན་པ་བསྒྲུབས་པ་རེད་བ། ད་མངོན་སུམ་ཁོ་རང་དང་ངེས་ཤེས།  ,e nas de ma yin pa bsgrubs pa red ba/_da mngon sum kho rang dang nges shes/__,https://d38pmlk0v88drf.cloudfront.net/wav16k/STT_TT00827_0013_88033_to_91201.wav,STT_TT,2,64,3.168,wav16k/STT_TT00827_0013_88033_to_91201.wav,ཨེ་ནས་དེ་མ་ཡིན་པ་སྒྲུབ་པ་རེད་བ། ད་མངོན་སུམ་ཁོ་རང་དང་ངེས་ཤེས།
STT_TT00827_0018_107447_to_110071,དོན་གྱི་རང་གི་ངོ་བོ་གཅིག། བདག་ཉིད་མངོན་སུམ་ཡིན་པ་ལ། ཟེ་དུས།  ,don gyi rang gi ngo bo gcig/_bdag nyid mngon sum yin pa la/_ze dus/__,https://d38pmlk0v88drf.cloudfront.net/wav16k/STT_TT00827_0018_107447_to_110071.wav,STT_TT,2,61,2.624,wav16k/STT_TT00827_0018_107447_to_110071.wav,དོན་གྱི་རང་གི་ངོ་བོ་གཅིག བདག་ཉིད་མངོན་སུམ་ཡིན་པ་ལ་ཟེ་དུས།
STT_TT00827_0019_114615_to_116855,ཨེ་ནས། དེའི་སྐབས་སུ་བདག་ཉིད་མངོན་སུམ་ཡིན་པ་ལ་ཟེ་ལབ་བྱས།  ,e nas/_de'i skabs su bdag nyid mngon sum yin pa la ze lab byas/__,https://d38pmlk0v88drf.cloudfront.net/wav16k/STT_TT00827_0019_114615_to_116855.wav,STT_TT,2,57,2.24,wav16k/STT_TT00827_0019_114615_to_116855.wav,ཨེ་ནས་དེའི་སྐབས་སུ་བདག་ཉིད་མངོན་སུམ་ཡིན་པ་ལ་ཟེ་ལབ་བྱས།
STT_TT00827_0026_166338_to_170210,མ་མཐོང་ཞིང་མ་གཞལ་བའི་ཆ་གཞན་ཅི་ཡང་མེད་པར་ཐལ་བའི་ཐལ་བ་གཏང་བསྡད་ཀི་འདུག་དྲན་པ་འདྲ་བོ་ཅིག་ཡོད་རེད་ལ།  ,ma mthong zhing ma gzhal ba'i cha gzhan ci yang med par thal ba'i thal ba gtang bsdad ki 'dug dran pa 'dra bo cig yod red la/__,https://d38pmlk0v88drf.cloudfront.net/wav16k/STT_TT00827_0026_166338_to_170210.wav,STT_TT,2,98,3.872,wav16k/STT_TT00827_0026_166338_to_170210.wav,མ་མཐོང་ཞིང་མ་བྱལ་བའི་ཆ་གཞན་ཅི་ཡང་མེད་པར་ཐལ་བའི་ཐལ་བ་གཏང་བསྡད་ཀི་འདུག དྲན་པ་འདྲ་བོ་ཅིག་ཡོད་རེད་ལ།
STT_TT00827_0035_220757_to_223733,སྔར་དུ་དཔེར་ན། སྤྱི་རྟོག་པ་ཁོ་རང་སྒྲུབ་འཇུག་ཡིན་ན་ཟེ་ནས་སྐྱོན་བརྗོད།  ,sngar du dper na/_spyi rtog pa kho rang sgrub 'jug yin na ze nas skyon brjod/__,https://d38pmlk0v88drf.cloudfront.net/wav16k/STT_TT00827_0035_220757_to_223733.wav,STT_TT,2,70,2.976,wav16k/STT_TT00827_0035_220757_to_223733.wav,སྔར་དུ་དཔེར་ན། སྤྱི་རྟོག་པ་ཁོ་རང་སྒྲུབ་འཇུག་ཡིན་ན་ཟེར་ནས་སྐྱོན་བརྗོད།
STT_TT00827_0036_225493_to_227605,རྗེས་དཔག་སྒྲུབ་འཇུག་ཡིན་ན་ཟེ་ནས་སྐྱོན་བརྗོད་ཀི་ཡོད་ན་ཏན་ཏན།  ,rjes dpag sgrub 'jug yin na ze nas skyon brjod ki yod na tan tan/__,https://d38pmlk0v88drf.cloudfront.net/wav16k/STT_TT00827_0036_225493_to_227605.wav,STT_TT,2,61,2.112,wav16k/STT_TT00827_0036_225493_to_227605.wav,རྗེས་དཔག་སྒྲུབ་འཇུག་ཡོད་ན་ཟེ་ནས། སྐྱོན་བརྗོད་ཀི་ཡོད་ན། ཏན་ཏན།
STT_TT00827_0038_234069_to_236149,ད་རྗེས་སྒྲ་མི་རྟག་རྟོགས་ཀི་རྗེས་སུ་དཔག་པ་ལས་ཀྱང་ཟེ།  ,da rjes sgra mi rtag rtogs ki rjes su dpag pa las kyang ze/__,https://d38pmlk0v88drf.cloudfront.net/wav16k/STT_TT00827_0038_234069_to_236149.wav,STT_TT,2,53,2.08,wav16k/STT_TT00827_0038_234069_to_236149.wav,ད་སརྱས་སྒྲ་མི་རྟག་ལྡོག་ཀྱི་རྗེས་སུ་དཔག་པ་ལས་ཀྱང་ཟེ།
STT_TT00827_0039_245301_to_248309,མ་རྟོགས་པ་རྟོགས་པར་བྱ་བའམ། མ་ངེས་པ་ངེས་པར་བྱ་བའི་ཆེད་དུ་ཡང་།  ,ma rtogs pa rtogs par bya ba'am/_ma nges pa nges par bya ba'i ched du yang /__,https://d38pmlk0v88drf.cloudfront.net/wav16k/STT_TT00827_0039_245301_to_248309.wav,STT_TT,2,62,3.008,wav16k/STT_TT00827_0039_245301_to_248309.wav,མ་རྟོགས་པ་རྟོགས་པར་བྱ་བའམ། མ་ངེས་པ་ངེས་པར་བྱ་བའི་ཆེད་དུ་ཡང་།
