file_name,uni,wylie,url,dept,grade,char_len,audio_len,path,inf
STT_TT00826_0013_90349_to_99547,ཨེ་ནས། ཚད་མ་གཞན་ད་སྒྲ་གཞན་འཇུག་པ་སྒྲུབ་སྐབས་རེད་བ། སྒྲ་རྟོག་སྒྲུབ་འཇུག་ཡིན་ན། སྒྲ་འཇལ་བའི་རྗེས་སུ་མ་མཐོང་བ་མཐོང་བ་བྱ་བའི་ཆེད་དུ། ཨེ་ནས་འཇུག་པ་ཡེ་དོན་མེད།  ,e nas/_tshad ma gzhan da sgra gzhan 'jug pa sgrub skabs red ba/_sgra rtog sgrub 'jug yin na/_sgra 'jal ba'i rjes su ma mthong ba mthong ba bya ba'i ched du/_e nas 'jug pa ye don med/__,https://d38pmlk0v88drf.cloudfront.net/wav16k/STT_TT00826_0013_90349_to_99547.wav,STT_TT,2,155,9.198,wav16k/STT_TT00826_0013_90349_to_99547.wav,ཨེ་ནས། ཚད་མ་གཞན་དང་སྒྲ་གཞན་འཇུག་པར་སྒྲུབ་སྐབས་རེད་བ། སྒྲ་རྟོག་སྒྲུབ་འཇུག་ཡིན་ན། སྒྲ་འཇལ་བའི་རྗེས་སུ་མ་མཐོང་བ་མཐོང་བར་བྱ་བའི་ཆེད་དུ། ཨེ་ནས་འཇུག་པ་ཡང་དོན་མེད།
STT_TT00826_0021_143870_to_146430,འཇུག་མི་དགོས་ཟེ་ནས། མ་ཟད་ཟེ་ཡ་གི་ཚིག་ཅིག་སྦྱར་ནས་དེ་ལ་ཡ།  ,'jug mi dgos ze nas/_ma zad ze ya gi tshig cig sbyar nas de la ya/__,https://d38pmlk0v88drf.cloudfront.net/wav16k/STT_TT00826_0021_143870_to_146430.wav,STT_TT,2,58,2.56,wav16k/STT_TT00826_0021_143870_to_146430.wav,འཇུག་མི་དགོས་ཟེ་ནས། མ་ཟད་ཟེ་ཡ་གི་ཚིག་གཅིག་སྦྱར་ནས་ དེ་ལ་ཡ།
STT_TT00826_0025_165530_to_167802,མངོན་སུམ་གྱིས་དྲངས་པའི་ངེས་ཤེས་ལ་སྦྱར་ནས་བཀག་ཡོང་དུས་སྒང་ལ།  ,mngon sum gyis drangs pa'i nges shes la sbyar nas bkag yong dus sgang la/__,https://d38pmlk0v88drf.cloudfront.net/wav16k/STT_TT00826_0025_165530_to_167802.wav,STT_TT,2,61,2.272,wav16k/STT_TT00826_0025_165530_to_167802.wav,མངོན་སུམ་གྱིས་དྲངས་པའི་ངེས་ཤེས་ལ་སྦྱར་ནས་བཀག་ཡོང་དུས་སྒང་ལ།
STT_TT00826_0026_173865_to_176851,རྗེས་དཔག་དང་ངེས་ཤེས་གཉིས་ལ་བྱེ་བྲག་ཡིན་མིན་གི་ཁྱད་པར་ག་རེ་འདུག་ཟེ།  ,rjes dpag dang nges shes gnyis la bye brag yin min gi khyad par ga re 'dug ze/__,https://d38pmlk0v88drf.cloudfront.net/wav16k/STT_TT00826_0026_173865_to_176851.wav,STT_TT,2,68,2.986,wav16k/STT_TT00826_0026_173865_to_176851.wav,རྗེས་དཔག་ད་ངེས་ཤེས་གཉིས་ལ་ བྱེ་བྲག་ཡིན་མིན་གི་ཁྱད་པར་ག་རེ་འདུག་ཟེ།
STT_TT00826_0027_177295_to_180503,ད་སྤྱིར་བསྟན་པ་ཟེ་ཡ་དེ། རྟོག་པ་སྤྱིར་བཏང་ལ་སྦྱར་བ་རེད་ཟེ་ལབ་ན་ལྟ་རྒྱུ་ཡོད་ ,da spyir bstan pa ze ya de/_rtog pa spyir btang la sbyar ba red ze lab na lta rgyu yod _,https://d38pmlk0v88drf.cloudfront.net/wav16k/STT_TT00826_0027_177295_to_180503.wav,STT_TT,2,75,3.208,wav16k/STT_TT00826_0027_177295_to_180503.wav,ད་སྤྱིར་བསྟན་པ་ཟེར་ཡ་དེ། རྟོག་པ་སྤྱིར་བཏང་ལ་སྦྱར་བ་རེད་ཟེ་ལབ་ན། ལྟ་རྒྱུ་ཡོད།
STT_TT00826_0004_13950_to_22465,ད་དང་པོ་ལ་ཨེ་ནས་ཆོས་ཅན་འཇལ་བའི་ཚད་མ་དེ་ལས་ཚད་མ་གཞན་དང་སྒྲ་གཞན་འཇུག་པར་བསྒྲུབ་པ་དེ་ལ། སྤྱིར་བསྟན་པ་དང་བྱེ་བྲག་ཏུ་བསྟན་པ་གཉིས་ཟེ། ད་འདི་ཐར་ལམ་གསལ་བྱེད་ཀི་བྱས་ན།  ,da dang po la e nas chos can 'jal ba'i tshad ma de las tshad ma gzhan dang sgra gzhan 'jug par bsgrub pa de la/_spyir bstan pa dang bye brag tu bstan pa gnyis ze/_da 'di thar lam gsal byed ki byas na/__,https://d38pmlk0v88drf.cloudfront.net/wav16k/STT_TT00826_0004_13950_to_22465.wav,STT_TT,2,160,8.515,wav16k/STT_TT00826_0004_13950_to_22465.wav,ད་དང་པོ་ལ། ཨེ་ནས་ཆོས་ཅན་འཇལ་བའི་ཚད་མ་དེ་ལས། ཚད་མ་གཞན་ད་སྒྲ་གཞན་འཇུག་པར་སྒྲུབ་པ་དེ་ལ། སྤྱིར་བསྟན་པ་དང་བྱེ་བྲག་ཏུ་བསྟན་པ་གཉིས་ཟེ། ད་འདི་ཐར་ལམ་གསལ་བྱེད་ཀིས་བྱས་ན།
STT_AB00320_0053_172551_to_175366,དབང་པོའི་ངོ་བོ་དང་མཐུན་པར་དབང་བྱེད་པའི་ཕྱིར་ཏེ།  ,dbang po'i ngo bo dang mthun par dbang byed pa'i phyir te/__,https://d38pmlk0v88drf.cloudfront.net/wav16k/STT_AB00320_0053_172551_to_175366.wav,STT_AB,2,49,2.815,wav16k/STT_AB00320_0053_172551_to_175366.wav,དབང་པོའི་ངོ་བོ་དང་མཐུན་པར་དབང་བྱེད་པའི་ཕྱིར་ཏེ།
STT_TT00826_0009_49786_to_54496,རེད་བ། སྤྱིར་བསྟན་པ་ཟེར་ཡ་དེ་མངོན་སུམ་གྱིས་གྲུབ་པའི་ངེས་ཤེས་སྤྱིར་བཏང་། ཨེ་ནས་རྟོག་པ་ལ་སྦྱར་དགོས་ཀི་མེད་འགྲོ་དྲན་གི་ ,red ba/_spyir bstan pa zer ya de mngon sum gyis grub pa'i nges shes spyir btang /_e nas rtog pa la sbyar dgos ki med 'gro dran gi _,https://d38pmlk0v88drf.cloudfront.net/wav16k/STT_TT00826_0009_49786_to_54496.wav,STT_TT,2,117,4.71,wav16k/STT_TT00826_0009_49786_to_54496.wav,རེད་བ། སྤྱིར་བསྟན་པ་ཟེ་ཡ་དེ་མངོན་སུམ་གྱིས་གྲུབ་པའི་ངེས་ཤེས་སྤྱིར་བཏང་། ཨེ་ནས་རྟོག་པ་ལ་སྦྱར་དགོས་ཀི་མེད་འགྲོ་དྲན་གི་
STT_HS0004_0034_237858_to_244325,པཱ་ལགས་ཀི་ནང་མི་ཚོ་ཨེ་ནས་བོད་ནང་ཕྱག་ལས་ག་རེ་གནང་གི་ཡོད་རེད། ལགས། པཱ་ལགས་ཀི་ནང་མི་ཚོ་བོད་ནང་ལ་ལས་ཀ་ག་རེ་བྱེད་གི་ཡོད་རེད། ལས་ཀ་ ,pA lags ki nang mi tsho e nas bod nang phyag las ga re gnang gi yod red/_lags/_pA lags ki nang mi tsho bod nang la las ka ga re byed gi yod red/_las ka _,https://d38pmlk0v88drf.cloudfront.net/wav16k/STT_HS0004_0034_237858_to_244325.wav,STT_HS,2,126,6.467,wav16k/STT_HS0004_0034_237858_to_244325.wav,པ་ལགས་ཀི་ནང་མི་ཚོ། ཨེ་ནས་ བོད་ནང་ཕྱག་ལས་ག་རེ་གནང་གོ་རེད། ལགས། པ་ལགས་ཀི་ནང་མི་ཚོ། བོད་ནང་ལ་ལས་ཀ་ག་རེ་བྱེད་གོ་རེད། ལས་ཀ
STT_TT00826_0014_101567_to_105695,དེའི་རྗེས་ཨ།་ཚད་མ་གཞན་ད་སྒྲ་གཞན་འཇུག་པ། རྟགས་ད་ཚད་མ་འཇུག་པ་དོན་མེད། མ་མཐོང་བ་མཐོང་བར་བྱ་བའི་ཆེད་དུ།  ,de'i rjes a/ tshad ma gzhan da sgra gzhan 'jug pa/_rtags da tshad ma 'jug pa don med/_ma mthong ba mthong bar bya ba'i ched du/__,https://d38pmlk0v88drf.cloudfront.net/wav16k/STT_TT00826_0014_101567_to_105695.wav,STT_TT,2,101,4.128,wav16k/STT_TT00826_0014_101567_to_105695.wav,དེའི་ཨ།་ཚད་མ་གཞན་ད་སྒྲ་གཞན་འཇུག་པ། རྟགས་ད་ཚད་མ་འཇུག་པ་དོན་མེད། མ་མཐོང་བ་མཐོང་བར་བྱ་བའི་ཆེད་དུ།
STT_HS0004_0070_469440_to_472800,དེ་དེའི་གཞུག་གུ་ལ་ངའི་ཅོ་ལགས་གཤེགས་ངེ་དེ་གས་ལས་ཀ་གནང་ཡོང་གི་ཡོད་རེད་བ།  ,de de'i gzhug gu la nga'i co lags gshegs nge de gas las ka gnang yong gi yod red ba/__,https://d38pmlk0v88drf.cloudfront.net/wav16k/STT_HS0004_0070_469440_to_472800.wav,STT_HS,2,72,3.36,wav16k/STT_HS0004_0070_469440_to_472800.wav,དེ་ནས་དེའི་གཞུག་ལ་ངས་ཇོ་ལགས་བཅག་མྱི་དེ་གས་ལས་ཀ་གནང་ཡོང་གོ་རེད་བ།
STT_HS0004_0079_549820_to_552790,ཁག་ལྔ་ད་དེ་ནས་རྒྱང་རྩེ་ནས་བར་དུ་ལ་ཡ།  ,khag lnga da de nas rgyang rtse nas bar du la ya/__,https://d38pmlk0v88drf.cloudfront.net/wav16k/STT_HS0004_0079_549820_to_552790.wav,STT_HS,2,38,2.97,wav16k/STT_HS0004_0079_549820_to_552790.wav,ཁ་ལྔ་ད་དེ་ནས་ྦྱང་རྩེ་ནས་བར་དུ་ལ་ཡ།
STT_HS0004_0101_704564_to_712585,ད་སོ་སོའི་ལུང་པའི་ནང་ལ་བསྡད་ངེ་དང་། ཡང་གང་དག་ལ་ཡར་ཕཱོན་གཏང་རོགས་བྱས་ཟེར་ངེ་དེ་འདྲའི་ཡོང་གི་རེད་བ། ཨོ་དེ། ད་ང་ང་ཚོས་བཏང་གི་རེད།  ,da so so'i lung pa'i nang la bsdad nge dang /_yang gang dag la yar phA+on gtang rogs byas zer nge de 'dra'i yong gi red ba/_o de/_da nga nga tshos btang gi red/__,https://d38pmlk0v88drf.cloudfront.net/wav16k/STT_HS0004_0101_704564_to_712585.wav,STT_HS,2,128,8.021,wav16k/STT_HS0004_0101_704564_to_712585.wav,ད་སོ་སོའི་ལུང་པའི་ནང་ལ་བསྡད་མྱི་དང་། ཡང་བཟའ་དག་ལ་ཡར་བུ་གཏང་རོགས་བྱེས་ཟེར་མྱི་དེ་འདྲས་ཡོང་གི་རེད་བ། ཨོ་དེ་ད་ང་ང་ཚོས་གཏང་གི་རེད།
STT_TT00826_0016_124206_to_128284,ཨེ་ནས་ཨེ། མཁས་གྲུབ་རིན་པོ་ཆེའི་ཊིཀ་ཆེན་གི་གསུང་སྟངས་དེ། སྤྱིར་བཏང་རང་འགྲེལ་དང་དཔེ་མཐུན་པོ་འདུག ,e nas e/_mkhas grub rin po che'i Tika chen gi gsung stangs de/_spyir btang rang 'grel dang dpe mthun po 'dug_,https://d38pmlk0v88drf.cloudfront.net/wav16k/STT_TT00826_0016_124206_to_128284.wav,STT_TT,2,95,4.078,wav16k/STT_TT00826_0016_124206_to_128284.wav,ཨེ་ནས།ཨ་མཁས་གྲུབ་རིན་པོ་ཆེའི་ཊིཀ་ཆེན་གི་གསུང་སྟངས་དེ། སྤྱིར་བཏང་རང་འགྲེལ་དང་དཔེ་མཐུན་པོ་འདུག
STT_TT00826_0029_189036_to_192684,ངེས་ཤེས་ལ་སྦྱར་བ་དང་རྗེས་པ་ལ་སྦྱར་བ་གཉིས་ལ། གཅིག་སྤྱིར་བསྟན་པ་ཟེ་སྤྱི་བྱེ་བྲག་ཏུ་བསྟན་པ་ཟེ་དགོས་ཡ།  ,nges shes la sbyar ba dang rjes pa la sbyar ba gnyis la/_gcig spyir bstan pa ze spyi bye brag tu bstan pa ze dgos ya/__,https://d38pmlk0v88drf.cloudfront.net/wav16k/STT_TT00826_0029_189036_to_192684.wav,STT_TT,2,100,3.648,wav16k/STT_TT00826_0029_189036_to_192684.wav,ངེས་ཤེས་ལས་སྦྱར་བ་དང་ རྗེས་དཔག་ལ་སྦྱར་བ་གཉིས་ལ། གཅིག་སྤྱིར་བསྟན་པ་ཟེ། གཅིག་བྱེ་བྲག་ཏུ་བསྟན་པ་ཟེ་དགོས་ཡ།
STT_TT00826_0041_291973_to_295781,སྒྲ་ཡི་ཐུན་མོང་མ་ཡིན་པའི་ཆོས་སྒྲ་མི་རྟག་པ་དང་། བྱས་པ་ལ་སོགས་པ་ཐམས་ཅད་ངེས་ནས།  ,sgra yi thun mong ma yin pa'i chos sgra mi rtag pa dang /_byas pa la sogs pa thams cad nges nas/__,https://d38pmlk0v88drf.cloudfront.net/wav16k/STT_TT00826_0041_291973_to_295781.wav,STT_TT,2,78,3.808,wav16k/STT_TT00826_0041_291973_to_295781.wav,སྒྲ་ཡི་ཐུན་མོང་མ་ཡིན་པའི་ཆོས་སྒྲ་མི་རྟག་པ་དང་བྱས་པ་ལ་སོགས་པ་ཐམས་ཅད་ངེས་ནས།
STT_TT00826_0043_316339_to_319257,ཨེ་ནས། སྒྲ་ལ་འཇུག་པའི་སྒྲ་རྟོག་སྒྲུབ་འཇུག་མ་ཡིན་ཏེ།  ,e nas/_sgra la 'jug pa'i sgra rtog sgrub 'jug ma yin te/__,https://d38pmlk0v88drf.cloudfront.net/wav16k/STT_TT00826_0043_316339_to_319257.wav,STT_TT,2,53,2.918,wav16k/STT_TT00826_0043_316339_to_319257.wav,ཨེ་ནས། སྒྲ་ལ་འཇུག་པའི་སྒྲ་རྟོག་སྒྲུབ་འཇུག་མ་ཡིན་ཏེ།
STT_TT00826_0044_319462_to_322807,ཁྱོད་ཀྱི་སྟེང་དུ་ཚད་མ་གཞན་དང་སྒྲ་གཞན་འཇུག་པའི་ཕྱིར་ཟེར་ཡ་དེ། ཐལ་འགྱུར་བཀོད་བཞག་པ་དེ་ག་རང་རེད་བསྡད་ ,khyod kyi steng du tshad ma gzhan dang sgra gzhan 'jug pa'i phyir zer ya de/_thal 'gyur bkod bzhag pa de ga rang red bsdad _,https://d38pmlk0v88drf.cloudfront.net/wav16k/STT_TT00826_0044_319462_to_322807.wav,STT_TT,2,99,3.345,wav16k/STT_TT00826_0044_319462_to_322807.wav,ཁྱོད་ཀྱི་སྟེང་དུ་ཚད་མ་གཞན་དང་སྒྲ་གཞན་འཇུག་པའི་ཕྱིར།་ཟེར་ཡ་དེ། ཐལ་འགྱུར་བཀོད་བཞག་པ་ད་ག་རང་རེད་བསྡད་ཡོད།
STT_TT00826_0047_341122_to_343234,ཨ་སྒྲ་འཛིན་མངོན་ཞུམ་མངོན་སུམ་གྱིས་ ,a sgra 'dzin mngon zhum mngon sum gyis _,https://d38pmlk0v88drf.cloudfront.net/wav16k/STT_TT00826_0047_341122_to_343234.wav,STT_TT,2,35,2.112,wav16k/STT_TT00826_0047_341122_to_343234.wav,ཨ་སྒྲ་འཛིན་མངོན་སུམ་མངོན་སུམ་གྱིས་
STT_TT00826_0048_346594_to_348770,དེས་དྲངས་པའི་སྒྲ་ངེས་པའི་ངེས་ཤེས་དེས།  ,des drangs pa'i sgra nges pa'i nges shes des/__,https://d38pmlk0v88drf.cloudfront.net/wav16k/STT_TT00826_0048_346594_to_348770.wav,STT_TT,2,39,2.176,wav16k/STT_TT00826_0048_346594_to_348770.wav,དེས་དྲངས་པའི་སྒྲ་ངེས་པའི་ངེས་ཤེས་དེས།
STT_AB00494_0075_276254_to_277192,འོན་ཀྱང་ ,'on kyang _,https://d38pmlk0v88drf.cloudfront.net/wav16k/STT_AB00494_0075_276254_to_277192.wav,STT_AB,2,9,0.938,wav16k/STT_AB00494_0075_276254_to_277192.wav,འོན་ཀྱང་
STT_TT00826_0049_349154_to_351554,ཨ་སྒྲ་ཡི་ཆོས་ཐམས་ཅད་ངེས་པར་འགྱུར་ལ་ཟེ།  ,a sgra yi chos thams cad nges par 'gyur la ze/__,https://d38pmlk0v88drf.cloudfront.net/wav16k/STT_TT00826_0049_349154_to_351554.wav,STT_TT,2,40,2.4,wav16k/STT_TT00826_0049_349154_to_351554.wav,ཨ་སྒྲ་ཡི་ཆོས་ཐམས་ཅད་ངེས་པར་འགྱུར་ལ་ཟེ།
STT_TT00826_0031_203438_to_211595,ད་དང་པོ་ཐལ་བ་དགོད་པ་དེ་ལ། ཨེ་ནས་རྩ་བ་བྱས་ན། དོན་གྱི་རང་གི་ངོ་བོ་གཅིག། བདག་ཉིད་མངོན་སུམ་ཡིན་པ་ལ། ཚད་མ་རྣམས་ཀྱིས་བརྟག་བྱ་གང་། མ་མཐོང་ཆ་གཞན་ཅི་ཞིག་ཡོད། ཟེ།  ,da dang po thal ba dgod pa de la/_e nas rtsa ba byas na/_don gyi rang gi ngo bo gcig/_bdag nyid mngon sum yin pa la/_tshad ma rnams kyis brtag bya gang /_ma mthong cha gzhan ci zhig yod/_ze/__,https://d38pmlk0v88drf.cloudfront.net/wav16k/STT_TT00826_0031_203438_to_211595.wav,STT_TT,2,154,8.157,wav16k/STT_TT00826_0031_203438_to_211595.wav,ད་དང་པོ། ཐལ་བ་འགོད་པ་དེ་ལ། ཨེ་ནས། རྩ་བ་བྱས་ན། དོན་གྱི་རང་གི་ངོ་བོ་ཅིག། བདག་ཉིད་མངོན་སུམ་ཡིན་པ་ལ། ཚད་མ་རྣམས་ཀྱིས་རྟགས་བྱ་གང་། མ་མཐོང་ཆ་གཞན་ཅི་ཞིག་ཡོད་ཟེ།
STT_TT00826_0036_238933_to_246237,མངོན་སུམ་དུ་གྲུབ་པ་ཡིན་ཞིང་ཟེ་རེད་བ། སྒྲ་འཛིན་མངོན་སུམ་དེ་གིས་སྒྲ་ཡི་ཐུན་མོང་མ་ཡིན་པའི་དོན་གྱི་རང་གི་ངོ་བོ་བདག་ཉིད་མངོན་སུམ་དུ་གྲུབ་པ་ཡིན་ཞིང་།  ,mngon sum du grub pa yin zhing ze red ba/_sgra 'dzin mngon sum de gis sgra yi thun mong ma yin pa'i don gyi rang gi ngo bo bdag nyid mngon sum du grub pa yin zhing /__,https://d38pmlk0v88drf.cloudfront.net/wav16k/STT_TT00826_0036_238933_to_246237.wav,STT_TT,2,145,7.304,wav16k/STT_TT00826_0036_238933_to_246237.wav,མངོན་སུམ་དུ་གྲུབ་པ་ཡིན་ཞིང་ཟེ་རེད་བ། སྒྲ་འཛིན་མངོན་སུམ་དེ་གིས་སྒྲ་ཡི་ཐུན་མོང་མ་ཡིན་པའི་དོན་གྱི་རང་གི་ངོ་བོ་བདག་ཉིད་མངོན་སུམ་དུ་གྲུབ་པ་ཡིན་ཞིང་།
STT_TT00826_0038_256476_to_263711,ཨེ་ནས་ཨ། སྒྲ་འཛིན་མངོན་སུམ་དེ་དང་འཇུག་ཚུལ་མཚུངས་པ་ཡིན་ཙང་། སྒྲུབ་འཇུག་རེད་འདུག་བ་ཟེ། ད་འདི་འཇུག་ཚུལ་མཚུངས་པའི་ཕྱིར་ཟེར་ཡ་དེ། སྒྲུབ་འཇུག་ཏུ་ཡིན་པ་མཚུངས་ཀི་འདུག་བ་ཟེ།  ,e nas a/_sgra 'dzin mngon sum de dang 'jug tshul mtshungs pa yin tsang /_sgrub 'jug red 'dug ba ze/_da 'di 'jug tshul mtshungs pa'i phyir zer ya de/_sgrub 'jug tu yin pa mtshungs ki 'dug ba ze/__,https://d38pmlk0v88drf.cloudfront.net/wav16k/STT_TT00826_0038_256476_to_263711.wav,STT_TT,2,166,7.235,wav16k/STT_TT00826_0038_256476_to_263711.wav,ཨེ་ནས། ཨ་ སྒྲ་འཛིན་མངོན་སུམ་དེ་དང་འཇུག་ཚུལ་མཚུངས་པ་ཡིན་ཙང་། སྒྲུབ་འཇུག་རེད་འདུག་ག་ཟེ། ད་འདིའི་འཇུག་ཚུལ་མཚུངས་པའི་ཕྱིར་ཟེ་ཡ་དེ། སྒྲུབ་འཇུག་ཏུ་ཡིན་པ་མཚུངས་ཀི་འདུག་ཨ་ཟེ།
STT_HS0004_0062_425759_to_427909,འདི་སློབ་ཚན་དེ་ག་བ་ནས་རག་སོང་། པཱ་ལགས་ལ་ ,'di slob tshan de ga ba nas rag song /_pA lags la _,https://d38pmlk0v88drf.cloudfront.net/wav16k/STT_HS0004_0062_425759_to_427909.wav,STT_HS,2,41,2.15,wav16k/STT_HS0004_0062_425759_to_427909.wav,འདི་སློབ་ཚན་དེ་ག་བ་ནས་རག་རེད་ པཱ་ལགས་ལ།
STT_HS0004_0064_433626_to_435912,བཟོ་ཡ་འདིའི་ལག་ཆ་ཆ་ཚང་ཡོད་རེད།  ,bzo ya 'di'i lag cha cha tshang yod red/__,https://d38pmlk0v88drf.cloudfront.net/wav16k/STT_HS0004_0064_433626_to_435912.wav,STT_HS,2,32,2.286,wav16k/STT_HS0004_0064_433626_to_435912.wav,བགོ་ཡ་དེ་ལག་ཆ་ཆ་ཚང་ཡོད་རེད།
STT_TT00826_0042_307534_to_315861,ད་གིན་ཐལ་འགྱུར་དེ། ད་གིན་རྟགས་སྦྱོར་ཅིག་འདུག་བ། དེ་ཐལ་འགྱུར་ལ་བཀོད་ནས་ཏག་ཏག་སླེབས་ཡོད་རེད། གོ་སོང་ང་། ཚད་མ་གཞན་དང་ཨེ་ནས་སྒྲ་གཞན་འཇུག་པའི་ཕྱིར་ཟེར་ཡ་ཅིག་ཡོད་རེད་བ།  ,da gin thal 'gyur de/_da gin rtags sbyor cig 'dug ba/_de thal 'gyur la bkod nas tag tag slebs yod red/_go song nga /_tshad ma gzhan dang e nas sgra gzhan 'jug pa'i phyir zer ya cig yod red ba/__,https://d38pmlk0v88drf.cloudfront.net/wav16k/STT_TT00826_0042_307534_to_315861.wav,STT_TT,2,164,8.327,wav16k/STT_TT00826_0042_307534_to_315861.wav,ད་གི་ཐལ་འགྱུར་ཏེ། ད་གིན་རྟགས་སྦྱོར་ཅིག་འདུག་ཨ། དེ་ཐལ་འགྱུར་ལ་བཀོད་ནས་ཏག་ཏག་སླེབས་ཡོད་རེད། གོ་སོང་ང། ཚད་མ་གཞན་དང་ཨེ་ནས་སྒྲ་གཞན་འཇུག་པའི་ཕྱིར་ཟེར་ཡ་ཅིག་ཡོད་རེད་བ།
STT_TT00826_0054_392184_to_394488,དོན་མེད་པར་ཐལ་བ་ལས་ཟེ། ད་དེ་འདྲའི་ཡིན་ན་ཟེ།  ,don med par thal ba las ze/_da de 'dra'i yin na ze/__,https://d38pmlk0v88drf.cloudfront.net/wav16k/STT_TT00826_0054_392184_to_394488.wav,STT_TT,2,45,2.304,wav16k/STT_TT00826_0054_392184_to_394488.wav,དོན་མེད་པར་ཐལ་བ་ལས་ཟེ། ད་དེ་འདྲའི་ཡིན་ན་ཟེ།
STT_TT00826_0055_399608_to_401752,རྟགས་དང་ཚད་མ་གཞན་འཇུག་པ་དོན་མེད་དུ་ཐལ་བ་ལས།  ,rtags dang tshad ma gzhan 'jug pa don med du thal ba las/__,https://d38pmlk0v88drf.cloudfront.net/wav16k/STT_TT00826_0055_399608_to_401752.wav,STT_TT,2,45,2.144,wav16k/STT_TT00826_0055_399608_to_401752.wav,རྟགས་དང་ཚད་མ་གཞན་འཇུག་པ་དོན་མེད་དུ་ཐལ་བ་ལས།
STT_TT00826_0046_331373_to_338302,མི་འཇུག་པར་ཐལ། ཁྱོད་ལ་འཇུག་པའི་སྒྲ་རྟོག་སྒྲུབ་འཇུག་ཡིན་པས་ཟེར་ཡ་ཅིག་ཆགས་སོང་བ། གོ་སོང་བ་སྒྲ་ལ་འཇུག་པའི་སྒྲ་རྟོག་སྒྲུབ་འཇུག་ཡིན་པས་ཟེར་ཡ་ཅིག་ཆགས་པ་རེད། ངེས་ཤེས་ཀྱང་དེ་དང་འཇུག་ཚུལ་མཚུངས་པའི་ཕྱིར།  ,mi 'jug par thal/_khyod la 'jug pa'i sgra rtog sgrub 'jug yin pas zer ya cig chags song ba/_go song ba sgra la 'jug pa'i sgra rtog sgrub 'jug yin pas zer ya cig chags pa red/_nges shes kyang de dang 'jug tshul mtshungs pa'i phyir/__,https://d38pmlk0v88drf.cloudfront.net/wav16k/STT_TT00826_0046_331373_to_338302.wav,STT_TT,2,195,6.929,wav16k/STT_TT00826_0046_331373_to_338302.wav,མི་འགྱུར་བ་ཐལ། ཁྱོད་ལ་འཇུག་པའི་སྒྲ་རྟོག་སྒྲུབ་འཇུག་ཡིན་པས་ཟེ་ཡ་ཅིག་ཆགས་སོང་བ། ག་སོང་། སྒྲ་ལ་འཇུག་པའི་སྒྲ་རྟོག་སྒྲུབ་འཇུག་ཡིན་པས་ཟེ་ཡ་ཅིག་ཆགས་པ་རེད། ངེས་ྱེས་ཀྱང་དེ་ལདར་འཇུག་ཚུལ་མཚུངས་པའི་ཕྱིར།
